{
  "$schema": "https://json-schema.org/draft/2020-12/schema",
  "$schemaVersion": "0.0.1",
  "$id": "https://raw.githubusercontent.com/smart-data-models/Candidates/master/standards/gaiax-ontology-v2111/models/DataTransfer/schema.json",
  "modelTags": "GaiaX,Ontology,Legal,DataUsage",
  "title": "Smart Data Models - Gaia-X Ontology - DataTransfer",
  "description": "https://w3id.org/gaia-x/2.1.11#class/DataTransfer. Defines the basic structure for data transfers, including reasons and scope. Base class with concrete subclasses SubProcessorDataTransfer and ThirdCountryDataTransfer in the Gaia-X ontology, each modeled as its own entity.",
  "type": "object",
  "properties": {
    "id": {
      "type": "string",
      "format": "uri",
      "description": "Property. Unique identifier of the entity"
    },
    "type": {
      "type": "string",
      "enum": [
        "DataTransfer"
      ],
      "description": "Property. NGSI-LD Entity type. It must be equal to 'DataTransfer'"
    },
    "dateCreated": {
      "type": "string",
      "format": "date-time",
      "description": "Property. Model:'https://schema.org/DateTime'. Entity creation timestamp."
    },
    "dateModified": {
      "type": "string",
      "format": "date-time",
      "description": "Property. Model:'https://schema.org/DateTime'. Timestamp of the last modification."
    },
    "source": {
      "type": "string",
      "description": "Property. A sequence of characters giving the source of the entity data."
    },
    "dataProvider": {
      "type": "string",
      "description": "Property. A sequence of characters identifying the provider of the harmonised data entity."
    },
    "reason": {
      "type": "string",
      "description": "Property. Reason for which the transfer might occur."
    },
    "scope": {
      "type": "string",
      "description": "Property. Perimeter of data that will be transferred."
    }
  },
  "required": [
    "id",
    "type",
    "reason",
    "scope"
  ]
}
