{
  "id": "urn:ngsi-ld:DataTransfer:001",
  "type": "DataTransfer",
  "dateCreated": "2026-08-20T10:00:00Z",
  "dateModified": "2026-08-20T10:00:00Z",
  "source": "https://docs.gaia-x.eu/ontology/v2111/classes/DataTransfer/",
  "dataProvider": "Gaia-X AISBL",
  "reason": "Technical support escalation",
  "scope": "Customer account metadata only, no payload data"
}
